{
  "versao": 1,
  "obra_id": "01M3SQA5QN93TVE2N4B0TXFW84",
  "revisao_modelo": 1,
  "imagem_sha256": "0ab5611795003aab332726e7e553748e877f5923f0ddb635bfd9d9710c366d8b",
  "tese": "Uma inferência da IA conecta as duas mãos: uma encobre parte do rosto; a outra mantém os óculos afastados dos olhos.",
  "afirmacoes_da_tese": [
    "01M3SQA5QNJQ7T6R6J5BVG7R8G",
    "01M3SQA5QN3W6KR9J61NZRYXM9",
    "01M3SQA5QN1B68VGKPZ5BF7XC3"
  ],
  "tempo": "estimado",
  "batidas": [
    {
      "inicio_s": 0,
      "fim_s": 5.95,
      "narracao": "Uma mão encobre parte do rosto; a outra segura os óculos longe dos olhos.",
      "legenda": "Uma mão encobre parte do rosto; a outra segura os óculos longe dos olhos.",
      "papel": "abertura",
      "afirmacoes": [
        "01M3SQA5QNJQ7T6R6J5BVG7R8G",
        "01M3SQA5QN3W6KR9J61NZRYXM9"
      ],
      "regiao_id": null,
      "camera": {
        "de": {
          "x": 0,
          "y": 0,
          "largura": 1,
          "altura": 1
        },
        "para": {
          "x": 0,
          "y": 0,
          "largura": 1,
          "altura": 1
        }
      }
    },
    {
      "inicio_s": 5.95,
      "fim_s": 13.9,
      "narracao": "No rosto, o sorriso mostra os dentes, enquanto os dedos atravessam a testa e a região de um olho.",
      "legenda": "No rosto, o sorriso mostra os dentes, enquanto os dedos atravessam a testa e a região de um olho.",
      "papel": "evidencia_visual",
      "afirmacoes": [
        "01M3SQA5QNJQ7T6R6J5BVG7R8G"
      ],
      "regiao_id": "01M3SQA5QMFHXT7CSR713K212T",
      "camera": {
        "de": {
          "x": 0.23,
          "y": 0.12,
          "largura": 0.56,
          "altura": 0.5
        },
        "para": {
          "x": 0.28,
          "y": 0.16,
          "largura": 0.46,
          "altura": 0.42
        }
      }
    },
    {
      "inicio_s": 13.9,
      "fim_s": 19.45,
      "narracao": "Abaixo, os grandes aros da armação aparecem diante do tronco, junto aos dedos.",
      "legenda": "Abaixo, os grandes aros da armação aparecem diante do tronco, junto aos dedos.",
      "papel": "evidencia_visual",
      "afirmacoes": [
        "01M3SQA5QN3W6KR9J61NZRYXM9"
      ],
      "regiao_id": "01M3SQA5QNXYDP97NJECTAN2KA",
      "camera": {
        "de": {
          "x": 0.02,
          "y": 0.66,
          "largura": 0.58,
          "altura": 0.34
        },
        "para": {
          "x": 0.03,
          "y": 0.7,
          "largura": 0.51,
          "altura": 0.29
        }
      }
    },
    {
      "inicio_s": 19.45,
      "fim_s": 29.4,
      "narracao": "O Fastnachtsmuseum interpreta os óculos como atributo da simplicidade do tolo. Não é possível determinar se o pintor pretendeu comunicar simplicidade por meio deles.",
      "legenda": "O Fastnachtsmuseum interpreta os óculos como atributo da simplicidade do tolo. Não é possível determinar se o pintor pretendeu comunicar simplicidade por meio deles.",
      "papel": "interpretacao",
      "afirmacoes": [
        "01M3SQA5QN59Z1J6E94VGB3AGB",
        "01M3SQA5QN208ZY4TSRAPJRYBY"
      ],
      "regiao_id": "01M3SQA5QNXYDP97NJECTAN2KA",
      "camera": {
        "de": {
          "x": 0.03,
          "y": 0.7,
          "largura": 0.51,
          "altura": 0.29
        },
        "para": {
          "x": 0,
          "y": 0,
          "largura": 1,
          "altura": 1
        }
      }
    },
    {
      "inicio_s": 29.4,
      "fim_s": 39.35,
      "narracao": "A leitura proposta pela IA conecta o gesto diante dos olhos aos óculos mantidos abaixo do rosto: uma associação possível pela disposição das mãos.",
      "legenda": "A leitura proposta pela IA conecta o gesto diante dos olhos aos óculos mantidos abaixo do rosto: uma associação possível pela disposição das mãos.",
      "papel": "interpretacao",
      "afirmacoes": [
        "01M3SQA5QN1B68VGKPZ5BF7XC3"
      ],
      "regiao_id": null,
      "camera": {
        "de": {
          "x": 0,
          "y": 0,
          "largura": 1,
          "altura": 1
        },
        "para": {
          "x": 0,
          "y": 0,
          "largura": 1,
          "altura": 1
        }
      }
    },
    {
      "inicio_s": 39.35,
      "fim_s": 47.3,
      "narracao": "Volte ao conjunto e acompanhe essa relação possível entre a mão diante do rosto e os óculos na outra.",
      "legenda": "Volte ao conjunto e acompanhe essa relação possível entre a mão diante do rosto e os óculos na outra.",
      "papel": "fechamento",
      "afirmacoes": [
        "01M3SQA5QN1B68VGKPZ5BF7XC3"
      ],
      "regiao_id": null,
      "camera": {
        "de": {
          "x": 0,
          "y": 0,
          "largura": 1,
          "altura": 1
        },
        "para": {
          "x": 0,
          "y": 0,
          "largura": 1,
          "altura": 1
        }
      }
    }
  ]
}
